{
  "name": "Nishanth Gadey",
  "email": "nishanthgnvs04@gmail.com",
  "phone": "+91-784-264-2651",
  "skills": [
    "Generative AI",
    "Deep Learning",
    "Machine Learning",
    "Data-driven projects",
    "AI models",
    "Python",
    "LangChain",
    "Django",
    "TensorFlow",
    "PyTorch",
    "Scikit-Learn",
    "LlamaIndex",
    "NLP",
    "Transformers",
    "Text Preprocessing",
    "LLMs",
    "Data Preprocessing",
    "Transfer Learning",
    "Model Evaluation",
    "Boosting Classifiers",
    "GANs",
    "JSON automation",
    "code generation",
    "testing",
    "debugging",
    "Image analysis",
    "Streamlit",
    "RAG",
    "PDF-based question answering",
    "YouTube video summarization",
    "MCQs"
  ],
  "work_experience": [
    {
      "company": "Tripsaverz",
      "role": "AI Intern",
      "dates": "July 2024 – Oct 2024",
      "description": "Developed and implemented AI-driven features to enhance user experience and optimize travel booking processes. Idea development for AI-driven features in JSON automation and Trip Planner projects. Collaborated with the development team on code generation, testing, and debugging for product enhancements. Leveraged LLMs to maximize user savings and deliver personalized travel recommendations. Technology Used: Python, LangChain, Django"
    }
  ],
  "education": [],
  "certifications": [
    {
      "name": "Developing Generative AI Applications",
      "issuing_organization": "edX, IBM",
      "date_obtained": "2024",
      "details": ""
    },
    {
      "name": "Neural Networks and Deep Learning",
      "issuing_organization": "DeepLearning.AI, Coursera",
      "date_obtained": "2024",
      "details": ""
    },
    {
      "name": "Introducing Generative AI with AWS",
      "issuing_organization": "Udacity",
      "date_obtained": "2024",
      "details": ""
    },
    {
      "name": "Data Mining",
      "issuing_organization": "NPTEL",
      "date_obtained": "2024",
      "details": "Gold Badge – Top5%"
    },
    {
      "name": "The Joy of Computing using Python",
      "issuing_organization": "NPTEL",
      "date_obtained": "2023",
      "details": "Gold Badge - Top2%"
    }
  ],
  "raw_text": "Nishanth Gadey\nnishanthgnvs04@gmail.com | +91-784-264-2651 | Razole, Andhra Pradesh, India, 533242\nhttps://www.linkedin.com/in/nishanth-gadey-458141261 | https://github.com/Nishanth456\nSUMMARY\nAI and ML enthusiast with hands-on experience in Generative AI, Deep Learning, Machine Learning, and data-driven\nprojects, aiming to innovate in the tech space. Experienced in working with AI models and exploring their real-world applications.\nEXPERIENCE\nTripsaverz | AI Intern July 2024 – Oct 2024\n• Developed and implemented AI-driven features to enhance user experience and optimize travel booking processes.\n• Idea development for AI-driven features in JSON automation and Trip Planner projects.\n• Collaborated with the development team on code generation, testing, and debugging for product enhancements.\n• Leveraged LLMs to maximize user savings and deliver personalized travel recommendations.\nTechnology Used: Python, LangChain, Django\nPUBLICATIONS\n• Conference Paper: “An Artificial Intelligence based Attendance Monitoring System for Malpractice Control” presented\nat MAI 2023 conference by NIT Patna\n• Book Chapter: “Enhancing 5G and IoT network security: A multi-model DL approach for attack classification”\n• Patent: \"A System and a Method for Detection and Prevention of Attacks in IOT Networks\"\nCERTIFICATIONS\n➢ Developing Generative AI Applications, edX, IBM, 2024\n➢ Neural Networks and Deep Learning, DeepLearning.AI, Coursera, 2024\n➢ Introducing Generative AI with AWS, Udacity, 2024\n➢ Data Mining, NPTEL, Gold Badge – Top5%, 2024\n➢ The Joy of Computing using Python, NPTEL, Gold Badge - Top2%, 2023\nSKILLS\nProgramming & AI Tools: Python, TensorFlow, PyTorch, Scikit-Learn, LangChain, LlamaIndex\nML & DL Expertise: Machine Learning, Deep Learning, NLP (Transformers, Text Preprocessing), Generative AI (LLMs)\nData & Modeling: Data Preprocessing, Transfer Learning, Model Evaluation, Boosting Classifiers, GANs\nPROJECTS\n• Alzheimer MRI Scan Brain Disease Classification using ResNet-18 | 2024\nDeveloped a classification model using proposed SEResNet-Mix architecture, achieving 99.02% F1-score on balancing\nimbalanced Alzheimer MRI dataset, enhancing early detection of brain disease through image analysis.\n• Blog-Post-Generator-Llama2 | 2024\nBuilt a blog post generator that allows users to input a topic, specify length, and target audience, automatically\ngenerating content using LangChain and Llama2 through a Streamlit interface.\n• LLM Study App | 2023\nDeveloped a learning tool using the Llama2-70B-Chat Model with RAG approach for PDF-based question answering,\nYouTube video summarization, and generating quizzes with MCQs. Enabled accurate responses and knowledge testing features.\n• CIC 2023 dataset based IOT attack classification using Hybrid Deep Learning model | 2023\nEngineered a Hybrid Deep Learning model to classify attacks using the CIC 2023 IoT original attacks dataset, achieving\nhigh accuracy of 98.45%, and enhancing security measures.\n• Credit Card Offer Acceptance Prediction with Boosting and Bagging classifiers | 2023\nImplemented and optimized machine learning algorithms to predict credit card offer acceptance based on bank user data,\nachieving a highest accuracy of 95.14%, which improved targeting of potential customers effectively.\nACHIEVEMENTS\n• Advanced to the round 2 of ML Hackathon 2K23 at Vishnu Institute of Technology, Bhimavaram\n• Earned a coveted spot in the Amazon ML Summer School 2024"
}