{
  "name": "ROHITH SAMUEL DIDLA",
  "email": "didlarohithsamuel25@gmail.com",
  "phone": "+91 8331076519",
  "skills": [
    "Python",
    "SQL",
    "MATLAB",
    "Arduino IDE",
    "VScode",
    "Communication",
    "Teamwork",
    "Collabration",
    "Listening and Learning skills",
    "English",
    "Telugu"
  ],
  "work_experience": [],
  "education": [
    {
      "institution": "Sagi RamaKrishnam Raju Engineering College, Bhimavaram",
      "degree": "Bachelor of Technology in Electronics and Communication Engineering",
      "graduation_date": "2021-2025",
      "details": null
    }
  ],
  "certifications": [
    {
      "name": "Digital VLSI using DSCH Software",
      "issuing_organization": null,
      "date_obtained": null,
      "details": null
    },
    {
      "name": "AWS Cloud Computing",
      "issuing_organization": null,
      "date_obtained": null,
      "details": null
    },
    {
      "name": "Problem solving using python(Basic) in HackerRank",
      "issuing_organization": "HackerRank",
      "date_obtained": null,
      "details": null
    },
    {
      "name": "UI/UX Designing workshop",
      "issuing_organization": null,
      "date_obtained": null,
      "details": null
    }
  ],
  "raw_text": "ROHITH SAMUEL DIDLA\n+91 8331076519 ⋄ didlarohithsamuel25@gmail.com\nOBJECTIVE\nTo leverage my technical expertise, problem-solving abilities, and passion for innovation to contribute to the\nsuccess of the organization while continually enhancing my skills. Committed to delivering high-quality results\nand driving impactful solutions in a dynamic and challenging environment.\nACADEMIC QUALIFICATIONS\nBachelor of Technology in Electronics and Communication Engineering 2021-2025\nSagi RamaKrishnam Raju Engineering College, Bhimavaram. CGPA: 7.82.\nBoard Of Intermediate 2019-2021\nEducare Junior College, Tatipaka, 88%.\nSSC, Class X 2019\nMaria Montissori EM High School,Tatipaka, GPA: 9.8.\nSKILLS\nTechnical Skills : Python, SQL.\nTools : MATLAB, Arduino IDE, VScode.\nSoft skills: Communication, Teamwork, Collabration.\nListening and Learning skills.\nLanguages: English, Telugu.\nPROJECTS\nWebsite Hosting Using EC2 , Loadbalancer , Couldfront in AWS. July-Sep 2023\nUtilize Amazon EC2 instances to host the Building Construction website, providing scalable compute capacity.\nIOT : Fire Alarm using ESP8266.\nDevelopment of an IoT-based fire alarm system using the ESP8266 microcontroller for real-time monitoring and\nalerting.\nCERTIFICATION\nDigital VLSI using DSCH Software.\nAWS Cloud Computing.\nProblem solving using python(Basic) in HackerRank\nParticipation certificate on UI/UX Designing workshop.\nAREA OF INTEREST\nAdv Python.\nEmbedded systems with IOT.\nSolving problems based on python in Hackeer-Rank.\nDAILY ACTIVITIES\nListening music\nPlaying basketball\nEXTRA CURRICULARS\nFirst Prize in Basketball–Awardedforoutstandingperformanceandleadingtheteamtovictoryinthecollege\ntournament, 2022."
}