{
  "name": "Sahith Krishna",
  "email": "sahith090604@gmail.com",
  "phone": "+91-9390046004",
  "skills": [
    "Generative AI",
    "Deep Learning",
    "Machine Learning",
    "AI solutions",
    "ML workflows",
    "Python",
    "TensorFlow",
    "PyTorch",
    "Scikit-Learn",
    "LangChain",
    "LlamaIndex",
    "Java",
    "NLP",
    "Transformers",
    "Text Preprocessing",
    "LLMs",
    "Computer Vision",
    "Data Preprocessing",
    "Transfer Learning",
    "Model Evaluation",
    "Boosting",
    "Genetic Algorithms",
    "HTML5",
    "CSS3",
    "SQL",
    "MongoDB",
    "Git",
    "GitHub",
    "Data visualizations"
  ],
  "work_experience": [
    {
      "company": "Smart Bridge",
      "role": "Intern",
      "dates": "Aug 2023 – Nov 2023",
      "description": "Designed and implemented an Image Caption Generator using deep learning, achieving a BLEU score of 85%. Optimized machine learning pipelines, reducing training time by 20%. Presented project findings to stakeholders, providing actionable insights through data visualizations. Improved model inference speed by 15% through algorithm optimization."
    }
  ],
  "education": [
    {
      "institution": "VIT - AP University",
      "degree": "B.Tech in CSE – AI & ML",
      "graduation_date": "2021 – 2025",
      "details": "CGPA: 8.32"
    }
  ],
  "certifications": [
    {
      "name": "Artificial Intelligence - Machine Learning",
      "issuing_organization": "IBM Skills Build",
      "date_obtained": "2024",
      "details": null
    },
    {
      "name": "AI & ML",
      "issuing_organization": "Google Developers",
      "date_obtained": "2023",
      "details": null
    },
    {
      "name": "Microsoft PL-100: Power Platform App Maker",
      "issuing_organization": "Microsoft",
      "date_obtained": "2023",
      "details": null
    },
    {
      "name": "Digital Image Processing",
      "issuing_organization": "MatLab",
      "date_obtained": "2023",
      "details": null
    }
  ],
  "raw_text": "Sahith Krishna\n(cid:131) +91-9390046004 # sahith090604@gmail.com (cid:239) linkedin.com/in/sahith-krishna-55610a221 § github.com/Sai090604\nSummary\nAI/ML enthusiast and passionate software developer with hands-on experience in Generative AI, Deep Learning, and Machine\nLearning. Skilled in building innovative AI solutions, optimizing ML workflows, and applying AI to healthcare, finance, and\nreal-world challenges\nEducation\nVIT - AP University 2021 – 2025\nB.Tech in CSE – AI & ML CGPA: 8.32\nExperience\nSmart Bridge Aug 2023 – Nov 2023\nIntern Hyderabad\nDesigned and implemented an Image Caption Generator using deep learning, achieving a BLEU score of 85%.\nOptimized machine learning pipelines, reducing training time by 20%.\nPresented project findings to stakeholders, providing actionable insights through data visualizations.\nImproved model inference speed by 15% through algorithm optimization.\nSkills\nProgramming: Python, TensorFlow, PyTorch, Scikit-Learn, LangChain, LlamaIndex. Java\nML/DL: Machine Learning, Deep Learning, NLP (Transformers, Text Preprocessing), Generative AI (LLMs), Computer Vision.\nData: Data Preprocessing, Transfer Learning, Model Evaluation, Boosting, Genetic Algorithms.\nWeb: HTML5, CSS3 Databases: SQL, MongoDB.\nVersion Control: Git/GitHub\nProjects\nAlzheimer Disease Detection using DL Techniques 2024\nSEResNet-Mix Model\nDeveloped a classification model using the custom SEResNet-Mix architecture for Alzheimer MRI scans.\nAchieved an exceptional 99.02% F1-score on an imbalanced Alzheimer MRI dataset.\nImplementedfiveDLtechniques(Resnet-18,MobileNet-V3,Dense-Net,GoogleNet,EfficientnetB0)andComparedtheperformancewith\nour proposed model.\nEnhanced clinical decision-making by delivering highly accurate predictions.\nTechnologies:\n∗ PyTorch, Python, OpenCV, NumPy\nBioMistral Medical RAG Chatbot 2024\nHealthcare AI Assistant\nCreated a medical chatbot leveraging Retrieval-Augmented Generation (RAG) for real-time insights.\nIntegrated Biomistral LLM to provide accurate and evidence-based medical responses.\nDesigned the system to assist healthcare professionals and patients with reliable information.\nDeveloped intuitive and user-friendly conversational flows for enhanced experience.\nTechnologies:\n∗ LangChain, Biomistral 7B, Pubmedbert Sentence Embeddings, Chroma DB\nImage Caption Generator 2023\nDeep Learning Model\nBuilt a deep learning model to generate descriptive captions for images using CNN-LSTM architecture.\nDeployed the model for real-time captioning using Flask and Docker.\nEvaluated the system with BLEU and ROUGE metrics to ensure caption quality.\nIntegrated the system into a user-facing application for dynamic image captioning.\nTechnologies:\n∗ TensorFlow/Keras, ResNet, Flask\nStock Price Prediction using LSTM 2023\nTime-Series Forecasting Model\nDeveloped a predictive model using Long Short-Term Memory (LSTM) networks for stock price forecasting.\nProcessed time-series data with trend analysis, handling missing values to ensure reliable predictions.\nOptimized model performance by fine-tuning hyperparameters, improving forecast accuracy by 12%.\nProvided actionable insights for investors to enhance financial decision-making.\nTechnologies:\n· Keras, Pandas, NumPy, Matplotlib\nClubs and Organizations\nComputer Society of India (CSI) 2023 – 2024\nRole: Technical Team Member\nSpecialized in Machine Learning projects as part of the technical team.\nOrganized and participated in technical events, workshops, and hackathons to promote AI and ML learning.\nCollaborated with peers to develop innovative solutions for real-world problems using AI/ML.\nActively contributed to enhancing the technical community within CSI.\nAssociation for Computing Machinery (ACM) 2022 – 2023\nRole: Design Team Member\nCreated visually appealing designs for events, webinars, and competitions organized by the ACM chapter.\nCollaborated with the technical team to ensure cohesive branding and seamless event promotions.\nEnhanced engagement through innovative and engaging visual content, boosting event participation.\nSupported the team in designing marketing materials and event collateral.\nCertifications\nArtificial Intelligence - Machine Learning (IBM Skills Build, 2024).\nAI & ML Powered by Google Developers (2023).\nMicrosoft PL-100: Power Platform App Maker (2023).\nDigital Image Processing MatLab (2023)."
}