{
  "name": "Govindgari Sai Srushik",
  "email": "saisrushik98@gmail.com",
  "phone": "+91 6281069505",
  "skills": [
    "Machine Learning",
    "Deep Learning",
    "Language Modelling",
    "Generative AI",
    "Software Engineering",
    "Python",
    "Java",
    "HTML5",
    "CSS",
    "JavaScript",
    "ReactJs",
    "NodeJs",
    "SQL",
    "No-SQL",
    "Natural Language Processing",
    "Data Visualization",
    "NumPy",
    "Pandas",
    "Matplotlib",
    "Seaborn",
    "Scikit-Learn",
    "Tensorflow",
    "Pytorch",
    "Azure AI",
    "Flask",
    "Streamlit",
    "Team Work",
    "Problem Solving",
    "Time Management",
    "Decision Making",
    "Collaborative & Innovative mindset",
    "Command Line Interface",
    "Git",
    "GitHub",
    "Agile Methodology",
    "Text Preprocessing",
    "Word Embeddings",
    "Statistical Analysis",
    "Transformers"
  ],
  "work_experience": [],
  "education": [
    {
      "institution": "Vellore Institute of Technology (VIT-AP)",
      "degree": "B. Tech Computer Science and Engineering Specialization in Artificial Intelligence and Machine Learning",
      "graduation_date": "Currently in 4th year",
      "details": "Academic Courses: Data Structures & Algorithms, Artificial Intelligence, Machine Learning, Deep Learning, Python, Java, DBMS"
    },
    {
      "institution": "Pine Grove College",
      "degree": "Higher Secondary",
      "graduation_date": null,
      "details": "Related courses: Math, Physics, Chemistry"
    }
  ],
  "certifications": [
    {
      "name": "Microsoft Certified Azure AI Fundamentals (AI-900)",
      "issuing_organization": "Microsoft",
      "date_obtained": null,
      "details": null
    },
    {
      "name": "Externship Completion Certification",
      "issuing_organization": "SmartInternz",
      "date_obtained": null,
      "details": null
    },
    {
      "name": "Internship Completion Certification",
      "issuing_organization": "Ethnus",
      "date_obtained": null,
      "details": null
    },
    {
      "name": "Journey to Cloud: Envisioning Your Solution",
      "issuing_organization": "IBM Skills Build",
      "date_obtained": null,
      "details": null
    },
    {
      "name": "Getting Started with Enterprise Data Science",
      "issuing_organization": "IBM Skills Build",
      "date_obtained": null,
      "details": null
    },
    {
      "name": "Fundamentals of Deep Learning",
      "issuing_organization": "Nvidia",
      "date_obtained": null,
      "details": null
    },
    {
      "name": "Deep Learning with Pytorch",
      "issuing_organization": "Coursera",
      "date_obtained": null,
      "details": null
    },
    {
      "name": "Machine Learning with Python",
      "issuing_organization": "IBM (Edx)",
      "date_obtained": null,
      "details": null
    },
    {
      "name": "Pytorch Basics for Machine Learning",
      "issuing_organization": "IBM (Edx)",
      "date_obtained": null,
      "details": null
    },
    {
      "name": "Python Essentials for MLOPS",
      "issuing_organization": "Pragmatic Labs (Edx)",
      "date_obtained": null,
      "details": null
    },
    {
      "name": "SQL (Basic & Intermediate)",
      "issuing_organization": "HackerRank",
      "date_obtained": null,
      "details": null
    },
    {
      "name": "MERN – Full Stack Certifications",
      "issuing_organization": "Nxtwave",
      "date_obtained": null,
      "details": null
    }
  ],
  "raw_text": "Govindgari Sai Srushik\n+91 6281069505 | saisrushik98@gmail.com | https://www.linkedin.com/in/sai-srushik/ | https://github.com/saisrushik | Portfolio\nHaving an extensive project work experience in Machine Learning & Deep Learning and currently upskilling in Language\nModelling & Generative AI. Also possess a versatile skillset encompassing expertise in Machine Learning & also in Software\nEngineering which allows to develop innovative solutions which can benefit the company in multiple roles. Recognized amongst\npeers for Professionalism, dedication on work and being optimistic. Consistency and Constant Research are the major strengths.\nEducation\nVellore Institute of Technology (VIT-AP), India (CGPA: 8.57/10)\nB. Tech Computer Science and Engineering Specialization in Artificial Intelligence and Machine Learning. (Currently in 4th year).\nAcademic Courses: Data Structures & Algorithms, Artificial Intelligence, Machine Learning, Deep Learning, Python, Java, DBMS.\nPine Grove College, India (Percentage: 97%)\nHigher Secondary\nRelated courses: Math, Physics, Chemistry\nSkills\nProgramming Languages: Python, Java.\nFrontend: HTML5, CSS, JavaScript, ReactJs.\nBackend: NodeJs, Structured Query Language (SQL), No-SQL.\nML/Data Science: Machine Learning, Deep Learning, Natural Language Processing, Data Visualization, NumPy,\nPandas, Matplotlib, Seaborn, Scikit-Learn, Tensorflow, Pytorch, Azure AI.\nDeployment: Flask, Streamlit.\nSoft Skills: Team Work, Problem Solving, Time Management, Decision Making, Collaborative & Innovative mindset.\nDeveloper Tools: Command Line Interface, Git, GitHub.\nWorkshops/ Trainings\nAttendee – ACM Winter School, IIT Patna (18th Dec 2023 – 29th Dec2023)\n• Workshop was conducted on the topic ‘Recent Trends in AI/ML for Industry 4.0.’ Gained Insights on Research\nAdvancements on ML & NLP and Exposed to the Advanced AI Topics.\n• Trained with Hands-On learning in Exploratory Data Analysis, ML Models & Language Models.\nExternship Program – SmartInternz (Aug’ 2023 – Nov’ 2023)\n• A Team Collaborative project aimed to Develop an AI Model for health-care.\n• Worked on ‘Disease Diagnosis using Human Nails.’ – Tensorflow, Keras, Flask, Agile Methodology, Team Work,\nDecision Making, Communication.\nResearch Work\n➢ Hybrid Intelligent Systems-2023 (HIS2023) – Springer International Conference\n• Paper Titled with “Pneumonia Disease Prediction using VGG19 Architecture”.\n• Novelty of paper is to use the Callback APIs like EarlyStopping, ReduceLROnPlateau to reduce the\noverfitting and alter the Learning Rate to increase the efficiency of the model.\nProjects\n➢ Pneumonia Disease prediction\n• A model was designed using VGG19 Architecture. Adapted Transfer-Learning Models & Fine-Tunning\nTechniques to get better accuracy.\n• Achieved a potential Accuracy of 95.35%. – Deep Learning, Research Skills.\n➢ Disease Diagnosis using Human Nails\n• An AI model was developed by leveraging the power of CNN & Transfer Learning models. The model has\nachieved a nominal accuracy of 89.23%.\n• Model has the good ratio over F1-score, precession, and recall of confusion matrix. – Deep Learning, Flask,\nAgile Methodology.\n➢ Financial Complaint Summarization\n• A Novel Hybrid Model was developed using Extractive (BERT) – Abstractive (T5) Summarization Models.\nA Language Model that can adopt the capabilities of Q-Learning.\n• The Quality of Summarization Models was Evaluated by ROUGE Score Metrics (ROUGE-1),\n90.60(Extractive) & 80.40 (Abstractive) – Text Preprocessing, Word Embeddings, Statistical Analysis,\nPytorch, Transformers, Language Modelling, OpenAI, Hugging Face.\n➢ Twitter Clone Application (Backend)\n• A backend Application Developed using NodeJs. This Application includes various APIs based on CRUD\noperations. – NodeJs, ExpressJs, SQL.\n➢ NxtTrendz – Ecommerce Application (Frontend)\n• A Frontend Ecommerce Application is Developed using ReactJS framework by maintaining industry\nstandards like code readability & reliability.\n• Major features include, User Authentication, user Authorization to prime deals, adding product filters &\nsearch, Cart feature. – ReactJs.\nCourse Work/ Certifications\n➢ Microsoft Certified Azure AI Fundamentals (AI-900).\n➢ Externship Completion Certification by SmartInternz.\n➢ Internship Completion Certification by Ethnus.\n➢ Journey to Cloud: Envisioning Your Solution by IBM Skills Build.\n➢ Getting Started with Enterprise Data Science by IBM Skills Build.\n➢ Fundamentals of Deep Learning by Nvidia.\n➢ Deep Learning with Pytorch by Coursera.\n➢ Machine Learning with Python by IBM (Edx).\n➢ Pytorch Basics for Machine Learning by IBM (Edx).\n➢ Python Essentials for MLOPS by Pragmatic Labs (Edx).\n➢ SQL (Basic & Intermediate) by HackerRank.\n➢ MERN – Full Stack Certifications by Nxtwave.\nExtra & Co Curricular\n➢ Board Member at Machine learning club\n• Served as member for this non-profit Organization with more than 400+ recruited members.\n• My Team and me worked on ML learn program which enables to improve knowledge on AI and ML.\n➢ Performed as a Coordinator of Design Team for VITOPIA (Cultural Event) in my university.\n➢ Participated In Microsoft AI Skills Challenge 2024 and Acquired Skills in Azure AI. (AI-900, Azure AI\nFundamentals).\n➢ My Interests Includes Cooking, Movies, and Holiday Trips.\nI hereby declare all the above information is true.\n*** Best Thing that you can give to Yourself is, Positivity and Self -Confidence. ***"
}