{
  "name": "Morla Suhas",
  "email": "msuhas2003@gmail.com",
  "phone": "6302362929",
  "skills": [
    "Artificial Intelligence",
    "Machine Learning",
    "Python",
    "Java",
    "MYSQL",
    "LSTM",
    "Random Forest",
    "Regression",
    "Deep Learning",
    "TensorFlow",
    "Keras",
    "Pandas",
    "Arduino",
    "Feature Engineering",
    "Data Preprocessing",
    "Model Optimization"
  ],
  "work_experience": [
    {
      "company": "INTRAIN TECH",
      "role": "Intern",
      "dates": "Jan-2024 - March-2024",
      "description": "Medical Insurance Price Prediction Using Machine Learning in Python\nDesigned and implemented a machine learning model to predict medical insurance costs, leveraging regression techniques, feature engineering, and evaluation metrics."
    }
  ],
  "education": [
    {
      "institution": "Vellore Institute of Technology",
      "degree": "B-tech (Computer Science with AI specialization)",
      "graduation_date": "06/2021 – 05/2025",
      "details": "Cumulative GPA : 8.20/10.0"
    }
  ],
  "certifications": [
    {
      "name": "Artificial Intelligence and Machine Learning",
      "issuing_organization": "INTRAIN TECH",
      "date_obtained": null,
      "details": "Powered by Google Developers"
    }
  ],
  "raw_text": "Morla Suhas\nmsuhas2003@gmail.com 6302362929 3-66/1, Repalle, Guntur 01/12/2003\nlinkedin.com/in/suhas2003 github.com/Suhas1123\nPROFILE\nI consider myself a responsible and self motivated. I am looking forward for my first work experience\nEXPERIENCE\nArtificial Intelligence and Machine Learning - Intern INTRAIN TECH | Jan-2024 - March-2024\nMedical Insurance Price Prediction Using Machine Learning in Python\nDesigned and implemented a machine learning model to predict medical insurance costs, leveraging regression\ntechniques, feature engineering, and evaluation metrics.\nEDUCATION\nB-tech (Computer Science with AI specialization), 06/2021 – 05/2025 | Amaravathi, India\nVellore Institute of Technology\nCumulative GPA : 8.20/10.0\nIntermediate (Maths,Physics,Chemistry), Narayana Junior College 07/2019 – 04/2021 | Vijayawada, India\nCumulative Percentage: 94.7/100\nSKILLS\nCSE(AIML) — Competent\nProgramming Languages: Python, Java\n•\nDatabase: MYSQL\n•\nPROJECTS\nStock Price Prediction Using Machine Learning 04/2023\nDeveloped stock price prediction models using machine learning techniques like LSTM, Random Forest, and\nregression; integrated financial data preprocessing, feature engineering, and model optimization for actionable\ninsights.\nFire Fighting Robot using Arduino 05/2023\nDeveloped a smart Robot for fire fighting Technology Used: Arduino , Python\nIn this project we aim to reduce the effect of fires accidents which usually start from small flame, therefore people life\nand money would be saved. The robot can successfully find fire and reach it without running into obstacle.\nClassify and Monitor Environmental Changes Using Satellite Ongoing\nImagery\nUtilized the EuroSAT_RGB dataset of 27,000 labeled satellite images to systematically classify land use and cover into\n10 distinct classes, including ʻAnnual Crop,ʼ ʻForest,ʼ ʻResidential,ʼ and ʻWater Bodies.ʼ by using 2D images.\nCurrently exploring more hybrid models and aim to integrate 3D image technique for deep information Technology\nused : Deep Learning, Tensor flow, Keras, Pandas, Python\nCERTIFICATIONS & TRAINING\nITT Summer Internship AI ML INTRAIN TECH Artificial Intelligence and Machine Learning Powered\nby Google Developers\nINTERESTS\nInvesting in Stock Market Playing games Learning New Skills\nLANGUAGES KNOWN\nEnglish Telugu Hindi"
}