{
  "name": "SUSHANTH PEDAMALLU",
  "email": "sushanthpedamallu3425@gmail.com",
  "phone": "7993542916",
  "skills": [
    "Java",
    "Python",
    "Object-oriented design",
    "Spring",
    "Hibernate",
    "Network security",
    "Secure group communication",
    "Time Management",
    "Team Collaboration",
    "Communication",
    "Problem-Solving",
    "Cloud practitioner (AWS)"
  ],
  "work_experience": [],
  "education": [
    {
      "institution": "Vellore Institute Of Technology (VIT-AP)",
      "degree": "B.Tech in Computer Science in Engineering (Cyber Security)",
      "graduation_date": "May 2025 (expected)",
      "details": "GPA: 7.71/10\nRelated courses: Network security, Secure group communication."
    }
  ],
  "certifications": [
    {
      "name": "AWS Cloud practitioner",
      "issuing_organization": "AWS",
      "date_obtained": "2024",
      "details": null
    }
  ],
  "raw_text": "SUSHANTHPEDAMALLU\nLinkedIn⋄\nPhone: 7993542916 ⋄ Email: sushanthpedamallu3425@gmail.com\nSUMMARY\nMotivated and detail-oriented recent graduate with a Bachelor’s degree in Computer Science and a solid\nfoundation in Java development. Proficient in Java programming, object-oriented design, and key\nframeworks such as Spring and Hibernate. Hands-on experience gained through academic projects,\ninternships, and self-driven learning initiatives. Eager to leverage strong analytical skills and\nprogramming knowledge to contribute to innovative software solutions. Adept at problem-solving, quick\nto learn new technologies, and excited to work in collaborative, fast-paced environments. Committed to\ncontinuous learning and passionate about starting a career as a Java Developer.\nEDUCATION\nVellore Institute Of Technology (VIT-AP) May 2025 (expected)\nB.Tech in Computer Science in Engineering (Cyber Security)\nGPA: 7.71/10\nRelated courses: Network security, Secure group communication.\nSri chaitanya junior college March 2021\nIntermediate March 2019\nPercentage: 91.3\nRelated courses: Math, Physics,Chemistry.\nDr.K.K.R’s Gowtham (E.M)\n10th Standard GPA:\n8.8\nACHIEVEMENTS\nWin 2024\nAWS Cloud practitioner\nSKILLS/HOBBIES\nProgramming Languages Java, Python\nSoft Skills Time Management, Team Collaboration, Communication, Problem-Solving\nOptional Skill Cloud practitioner (AWS)\nHobbies cycling and reading comics"
}